[
{
	"icon": "http://examples.com/images/cat.png",
	"label": "Refer a friend",
	"behavior": "redirect",
	"uri": "https://referrals.com/jobs/1022?tracker=106645",
	"backgroundColor": "00DDEE",
	"textColor": "FF5522",
	"disabled": false
},
{
	"icon": "http://examples.com/images/dog.png",
	"label": "Share this job",
	"behavior": "modal",
	"uri": "https://sharing.com/jobs/1022?tracker=106645",
	"backgroundColor": "1133FF",
	"textColor": "FF3311",
	"disabled": false
}
]